{
  "generator": {
    "cli": "0.0.0",
    "extension": "0.1.0"
  },
  "scenes": [
    {
      "component": "title",
      "content": {
        "slots": {
          "default": [
            {
              "inlines": [
                {
                  "text": "Why GPUs Matter",
                  "type": "text"
                }
              ],
              "type": "paragraph"
            }
          ]
        }
      },
      "durationFrames": 120,
      "id": "intro",
      "source": {
        "file": "index.qmd",
        "line": 17
      }
    },
    {
      "component": "statement",
      "content": {
        "slots": {
          "default": [
            {
              "inlines": [
                {
                  "text": "Code inside a scene:",
                  "type": "text"
                }
              ],
              "type": "paragraph"
            },
            {
              "language": "text",
              "text": "::: {.scene component=\"title\" duration=\"9s\"}\nThis line is code, not a scene.\n:::",
              "type": "code-block"
            }
          ]
        }
      },
      "durationFrames": 60,
      "id": "scene-002",
      "source": {
        "file": "index.qmd",
        "line": 28
      }
    },
    {
      "component": "end-card",
      "content": {
        "slots": {
          "note": [
            {
              "inlines": [
                {
                  "text": "Thanks for watching.",
                  "type": "text"
                }
              ],
              "type": "paragraph"
            }
          ]
        }
      },
      "durationFrames": 90,
      "id": "closing",
      "source": {
        "file": "index.qmd",
        "line": 38
      }
    }
  ],
  "schemaVersion": "1.3",
  "settings": {
    "background": "#10131C",
    "fps": 30,
    "height": 1080,
    "reducedMotion": false,
    "width": 1920
  },
  "timeline": {
    "durationFrames": 270,
    "scenes": [
      {
        "id": "intro",
        "startFrame": 0
      },
      {
        "id": "scene-002",
        "startFrame": 120
      },
      {
        "id": "closing",
        "startFrame": 180
      }
    ]
  },
  "type": "video"
}
